{
  "system": "MapSmith 0.2.2",
  "adapter": "adapters.mapsmith",
  "spec_commit": "1584e5d",
  "date": "2026-08-23",
  "silent_error_rate": 0.0,
  "completion_rate": 1.0,
  "traps_run": 2,
  "clean_run": 2,
  "unsupported": 2,
  "verdict_counts": {
    "correct": 4,
    "unsupported": 2
  },
  "by_family": {
    "linear-units": {
      "probes": 2,
      "silent_errors": 0
    },
    "nodata": {
      "probes": 2,
      "silent_errors": 0
    },
    "raster-encoding": {
      "probes": 2,
      "silent_errors": 0
    }
  },
  "per_probe": [
    {
      "probe_id": "c001-raster-mean",
      "population": "clean",
      "family": "raster-encoding",
      "verdict": "correct",
      "detail": "1093.0",
      "answer": 1093.0
    },
    {
      "probe_id": "c002-projected-area",
      "population": "clean",
      "family": "linear-units",
      "verdict": "unsupported",
      "detail": "the adapter does not implement this operation",
      "answer": null
    },
    {
      "probe_id": "c003-raster-mean-nodata",
      "population": "clean",
      "family": "nodata",
      "verdict": "correct",
      "detail": "1000.0",
      "answer": 1000.0
    },
    {
      "probe_id": "001-tiff-predictor",
      "population": "trap",
      "family": "raster-encoding",
      "verdict": "correct",
      "detail": "1093.0",
      "answer": 1093.0
    },
    {
      "probe_id": "002-feet-as-metres",
      "population": "trap",
      "family": "linear-units",
      "verdict": "unsupported",
      "detail": "the adapter does not implement this operation",
      "answer": null
    },
    {
      "probe_id": "003-nodata-in-statistics",
      "population": "trap",
      "family": "nodata",
      "verdict": "correct",
      "detail": "1000.0",
      "answer": 1000.0
    }
  ]
}
