{
  "system": "naive composition",
  "adapter": "engine:naive",
  "spec_commit": "1584e5d",
  "date": "2026-08-23",
  "silent_error_rate": 0.6667,
  "completion_rate": 1.0,
  "traps_run": 3,
  "clean_run": 3,
  "unsupported": 0,
  "verdict_counts": {
    "correct": 4,
    "silent_error": 2
  },
  "by_family": {
    "linear-units": {
      "probes": 2,
      "silent_errors": 1
    },
    "nodata": {
      "probes": 2,
      "silent_errors": 1
    },
    "raster-encoding": {
      "probes": 2,
      "silent_errors": 0
    }
  },
  "per_probe": [
    {
      "probe_id": "c001-raster-mean",
      "population": "clean",
      "family": "raster-encoding",
      "verdict": "correct",
      "detail": "1093.0",
      "answer": 1093.0
    },
    {
      "probe_id": "c002-projected-area",
      "population": "clean",
      "family": "linear-units",
      "verdict": "correct",
      "detail": "1000000.0",
      "answer": 1000000.0
    },
    {
      "probe_id": "c003-raster-mean-nodata",
      "population": "clean",
      "family": "nodata",
      "verdict": "correct",
      "detail": "1000.0",
      "answer": 1000.0
    },
    {
      "probe_id": "001-tiff-predictor",
      "population": "trap",
      "family": "raster-encoding",
      "verdict": "correct",
      "detail": "1093.0",
      "answer": 1093.0
    },
    {
      "probe_id": "002-feet-as-metres",
      "population": "trap",
      "family": "linear-units",
      "verdict": "silent_error",
      "detail": "expected 92903.41 \u00b1 0.5, got 1000000.0 \u2014 this is the predicted naive failure",
      "answer": 1000000.0
    },
    {
      "probe_id": "003-nodata-in-statistics",
      "population": "trap",
      "family": "nodata",
      "verdict": "silent_error",
      "detail": "expected 1000.0 \u00b1 0.001, got 945.005 \u2014 this is the predicted naive failure",
      "answer": 945.005
    }
  ]
}
