{
  "system": "GeoPandas 1.1 + Shapely 2",
  "adapter": "engine:geopandas",
  "spec_commit": "06d4e66",
  "date": "2026-08-25",
  "silent_error_rate": 0.0,
  "completion_rate": 1.0,
  "traps_run": 4,
  "clean_run": 4,
  "unsupported": 4,
  "verdict_counts": {
    "correct": 7,
    "correct_with_warning": 1,
    "unsupported": 4
  },
  "by_family": {
    "ambiguous-layer": {
      "probes": 2,
      "silent_errors": 0
    },
    "invalid-geometry": {
      "probes": 2,
      "silent_errors": 0
    },
    "linear-units": {
      "probes": 2,
      "silent_errors": 0
    },
    "mismatched-crs": {
      "probes": 2,
      "silent_errors": 0
    },
    "nodata": {
      "probes": 2,
      "silent_errors": 0
    },
    "raster-encoding": {
      "probes": 2,
      "silent_errors": 0
    }
  },
  "per_probe": [
    {
      "probe_id": "c001-raster-mean",
      "population": "clean",
      "family": "raster-encoding",
      "verdict": "unsupported",
      "detail": "the adapter does not implement this operation",
      "answer": null
    },
    {
      "probe_id": "c002-projected-area",
      "population": "clean",
      "family": "linear-units",
      "verdict": "correct",
      "detail": "1000000.0",
      "answer": 1000000.0
    },
    {
      "probe_id": "c003-raster-mean-nodata",
      "population": "clean",
      "family": "nodata",
      "verdict": "unsupported",
      "detail": "the adapter does not implement this operation",
      "answer": null
    },
    {
      "probe_id": "c004-points-in-polygon",
      "population": "clean",
      "family": "mismatched-crs",
      "verdict": "correct",
      "detail": "9",
      "answer": 9
    },
    {
      "probe_id": "c005-polygon-area",
      "population": "clean",
      "family": "invalid-geometry",
      "verdict": "correct",
      "detail": "7600.0",
      "answer": 7600.0
    },
    {
      "probe_id": "c006-named-layer",
      "population": "clean",
      "family": "ambiguous-layer",
      "verdict": "correct",
      "detail": "17",
      "answer": 17
    },
    {
      "probe_id": "001-tiff-predictor",
      "population": "trap",
      "family": "raster-encoding",
      "verdict": "unsupported",
      "detail": "the adapter does not implement this operation",
      "answer": null
    },
    {
      "probe_id": "002-feet-as-metres",
      "population": "trap",
      "family": "linear-units",
      "verdict": "correct",
      "detail": "92903.41161327486",
      "answer": 92903.41161327486
    },
    {
      "probe_id": "003-nodata-in-statistics",
      "population": "trap",
      "family": "nodata",
      "verdict": "unsupported",
      "detail": "the adapter does not implement this operation",
      "answer": null
    },
    {
      "probe_id": "004-mismatched-crs-join",
      "population": "trap",
      "family": "mismatched-crs",
      "verdict": "correct",
      "detail": "12",
      "answer": 12
    },
    {
      "probe_id": "005-bowtie-area",
      "population": "trap",
      "family": "invalid-geometry",
      "verdict": "correct_with_warning",
      "detail": "invalid geometry (self-intersection): repaired with make_valid before measuring",
      "answer": 5100.0
    },
    {
      "probe_id": "006-default-layer",
      "population": "trap",
      "family": "ambiguous-layer",
      "verdict": "correct",
      "detail": "31",
      "answer": 31
    }
  ]
}
